{"type":"config","name":"Modal sweep val_bpb optimization","metricName":"best_val_bpb","metricUnit":"","bestDirection":"lower"}
{"run":1,"commit":"e1a5973","metric":0,"metrics":{},"status":"crash","description":"Baseline autoresearch harness failed locally because modal_app.py imports huggingface_hub but the local environment used by autoresearch.sh does not have it installed.","timestamp":1774024187637,"segment":0,"confidence":null}
{"run":2,"commit":"e1a5973","metric":0,"metrics":{},"status":"crash","description":"Baseline Modal sweep crashed because sweep_jobs writes /vol/runs/<sweep-id>.json without creating the parent /vol/runs directory first.","timestamp":1774025031220,"segment":0,"confidence":null}
{"run":3,"commit":"e1a5973","metric":0,"metrics":{},"status":"crash","description":"Baseline harness reached the sweep but failed when parsing the follow-up summary output; modal_app's CLI path did not emit a reliably parseable JSON payload for autoresearch.sh.","timestamp":1774025787791,"segment":0,"confidence":null}
{"run":4,"commit":"e1a5973","metric":0,"metrics":{},"status":"crash","description":"Baseline harness still failed because modal run writes its useful CLI output in a way the script was not capturing; autoresearch.sh needs to capture combined output and extract the JSON payload robustly.","timestamp":1774026408484,"segment":0,"confidence":null}
{"run":5,"commit":"e1a5973","metric":0,"metrics":{},"status":"crash","description":"Baseline harness switched to the Python Modal API but forgot to run inside modal_app.app.run(), so the remote Function was not hydrated.","timestamp":1774026549163,"segment":0,"confidence":null}
{"run":6,"commit":"e1a5973","metric":1.561,"metrics":{},"status":"checks_failed","description":"Baseline Modal sweep benchmark succeeded with best_val_bpb 1.561 on the 4-job proxy grid, artifact size stayed under cap, but autoresearch.checks.sh incorrectly referenced missing main.py.","timestamp":1774027201328,"segment":0,"confidence":null}
{"run":7,"commit":"2ede9a4","metric":1.5586,"metrics":{},"status":"keep","description":"Established a working autoresearch baseline for small 1xH100 Modal architecture sweeps: 4-job grid from IDEAS.md, best val_bpb 1.5586, artifact under the 16MB cap, with fast syntax checks passing.","timestamp":1774028098897,"segment":0,"confidence":null}
{"run":8,"commit":"2ede9a4","metric":1.548,"metrics":{},"status":"discard","description":"Adaptive short-run schedule defaults improved proxy best_val_bpb to 1.5480, but the best swept model grew to 17,051,201 bytes and violated the hard 16,000,000-byte artifact cap, so this benchmark improvement is not acceptable.","timestamp":1774028760750,"segment":0,"confidence":649.4166666666781}
{"type":"config","name":"Modal sweep val_bpb optimization (constraint-ranked)","metricName":"best_val_bpb","metricUnit":"","bestDirection":"lower"}
{"run":9,"commit":"dcb5111","metric":1.5604,"metrics":{},"status":"keep","description":"Re-baselined the Modal proxy sweep after fixing ranking to enforce the hard 16,000,000-byte artifact cap; best valid run is 1.5604 val_bpb with constraint_ok=1.","timestamp":1774029407022,"segment":1,"confidence":null}
{"run":10,"commit":"39c3a39","metric":1.5593,"metrics":{},"status":"keep","description":"Switched the Modal proxy environment to Python 3.14 and updated train_gpt compression to use stdlib zstd when available (fallback zlib otherwise), reducing compressed artifact size to 9.09MB and slightly improving constrained best_val_bpb to 1.5593.","timestamp":1774030189605,"segment":1,"confidence":null}
{"run":11,"commit":"39c3a39","metric":1.5703,"metrics":{},"status":"discard","description":"Adaptive short-run warmdown and optimizer warmup defaults under zstd compression made the constrained sweep clearly worse (1.5703 val_bpb) while staying under the cap, so the schedule adaptation does not help this proxy.","timestamp":1774030808795,"segment":1,"confidence":1}
{"run":12,"commit":"39c3a39","metric":1.5631,"metrics":{},"status":"discard","description":"Replacing the relu^2 MLP activation with silu^2 shrank the compressed artifact slightly but made constrained sweep quality worse (1.5631 val_bpb), so the smoother activation is not helping this workload.","timestamp":1774031409133,"segment":1,"confidence":0.5789473684211018}
{"run":13,"commit":"39c3a39","metric":1.5629,"metrics":{},"status":"discard","description":"Reducing the default qk_gain_init from 1.5 to 1.0 slightly worsened constrained sweep quality (1.5629 val_bpb) while leaving size comfortably under cap, so the original q/k gain is better for this proxy.","timestamp":1774031968523,"segment":1,"confidence":0.44000000000004974}
{"run":14,"commit":"39c3a39","metric":1.5692,"metrics":{},"status":"discard","description":"Inspired by PR #250, tested cosine warm restarts/SGDR on the constrained 4-job Modal proxy sweep. It was clearly worse (1.5692 val_bpb) than the current zstd baseline, so this schedule does not transfer cleanly to the short proxy.","timestamp":1774034147609,"segment":1,"confidence":0.34920634920638277}
