commit	best_val_bpb	best_eval	steps	train_time_s	memory_gb	total_bytes	code_bytes	model_bytes	pre_quantization_post_ema_eval_time_ms	pre_quantization_post_ema_val_bpb	pre_quantization_post_ema_val_loss	quantized_eval_time_ms	quantized_val_bpb	quantized_val_loss	quantized_sliding_window_eval_time_ms	quantized_sliding_window_val_bpb	quantized_sliding_window_val_loss	status	description
iter_0	0.000000		579	589.1	38.4	16052835	63784	15989051	22368	1.378239	3.560135	23831	1.383158	3.572841				keep	baseline (dev, TTT+sliding disabled)
iter_1	0.000000		602	588.7	38.4	16130096	64419	16065677	22533	1.359528	3.511801	23761	1.365064	3.526103				keep	per-group SDClip: early k*1.15, mid k, late k*0.88
iter_2	0.000000		606	588.9	38.4	16128884	64418	16064466	22342	1.358095	3.508099	23773	1.363156	3.521173				keep	QK-Gain 5.25->5.5 + per-group SDClip
iter_3	0.000000		606	588.3	38.4	16129474	64418	16065056	22401	1.356964	3.505179	23825	1.362061	3.518346				keep	QK-Gain 6.0 + per-group SDClip
iter_4	0.000000		606	588.1	38.4	16129198	64490	16064708	22361	1.356037	3.502785	23729	1.361312	3.516411				keep	cosine warmdown + QK-Gain 6.0 + per-group SDClip
iter_5	0.000000		390	588.5	38.4	16131483	64489	16066994	32224	1.459782	3.770768	34321	1.464988	3.784217				revert	EMA decay 0.995 (reverted, regression)
iter_6	0.000000		391	588.8	38.4	16133057	64490	16068567	32171	1.688005	4.360293	33727	1.694373	4.376742				revert	warmdown_frac 0.80 (reverted, regression)
iter_7	0.000000		789	1188.3	38.4	16129147	64618	16064529	32243	1.257458	3.248146	33415	1.262578	3.261371	1074859	1.246411	3.219610	keep	20min baseline + sliding window (same code as iter_4)
iter_8	0.000000		790	1189.2	38.4	16130014	64618	16065396	32171	1.259912	3.254483	33324	1.264954	3.267507	1050430	1.248681	3.225472	revert	QK-Gain 7.0 (reverted, +0.002)
iter_8b	0.000000		790	1188.8	38.4	16128573	64618	16063955	32131	1.257727	3.248839	33362	1.262801	3.261946	1050312	1.246621	3.220152	revert	QK-Gain 6.5 (reverted, saturated at 6.0)
iter_9	0.000000		790	1188.9	38.4	16098608	64630	16033978	32224	1.257092	3.247200	33340	1.262476	3.261107	1049597	1.246328	3.219394	keep	per-layer SDClip: 11 k-multipliers (1.20->0.80)
iter_10	0.000000		790	1188.8	38.4	16100151	64631	16035520	32243	1.257306	3.247751	33414	1.262579	3.261374	1052070	1.246430	3.219657	revert	GPTQ calibration 128 batches (reverted, no improvement)
iter_11	0.000000		790	1188.5	38.4	16099358	64630	16034728	32239	1.257176	3.247417	33305	1.262338	3.260750	1051415	1.246111	3.218834	keep	warmdown_frac 0.72->0.68
iter_12	0.000000		790	1189.0	38.4	16099276	64629	16034647	32278	1.260585	3.256223	33395	1.265405	3.268673	1052446	1.249169	3.226733	revert	Muon WD 0.11 (reverted, +0.003)
iter_13	0.000000		790	1189.1	38.4	16328891	64631	16264260	32270	1.257531	3.248334	33381	1.262042	3.259986	1053093	1.245850	3.218159	revert	embed_clip_sigmas 15 (reverted, +230KB size)
iter_14	0.000000		790	1188.9	38.4	16346231	64630	16281601	32269	1.257483	3.248208	33413	1.262438	3.261007	1053471	1.246295	3.219310	revert	steeper SDClip gradient 1.22->0.65 (reverted, +247KB)
iter_15	1.247099	quantized_sliding_window	790	1189.2	38.4	15659226	64629	15594597	32197	1.257289	3.247709	33385	1.263231	3.263057	1052528	1.247099	3.221385	revert	matrix_clip_sigmas 14.0 (superseded by 15b)
iter_15b	1.246327	quantized_sliding_window	790	1188.8	38.4	15844295	64629	15779666	32167	1.257248	3.247602	33308	1.262595	3.261413	1049188	1.246327	3.219391	keep	matrix_clip_sigmas 13.5 (first PASS 16MB)
iter_16	1.186474	quantized_sliding_window	1158	1188.2	25.8	15847195	64629	15782566	32308	1.197604	3.093535	33373	1.202881	3.107166	1051464	1.186474	3.064786	revert	batch 786K->524K (reverted, step-count artifact on 1xH100)
iter_17	1.170116	quantized_sliding_window	1511	1188.8	19.6	15845998	64629	15781369	31654	1.180888	3.050357	33890	1.186658	3.065261	1056677	1.170116	3.022531	revert	batch 524K->393K (reverted, step-count artifact on 1xH100)
iter_18	1.165941	quantized_sliding_window	2172	1188.5	13.3	15846878	64629	15782249	32396	1.176494	3.039007	33408	1.182664	3.054943	1055173	1.165941	3.011747	revert	batch 393K->262K (reverted, step-count artifact on 1xH100)
iter_19	1.166990	quantized_sliding_window	2744	1188.4	10.2	15848642	64629	15784013	32539	1.176724	3.039601	33590	1.183662	3.057522	1060691	1.166990	3.014456	revert	batch 262K->196K (reverted, past noise crossover)
iter_20	1.168591	quantized_sliding_window	2174	1188.4	13.3	15848340	64629	15783711	31646	1.179135	3.045828	33633	1.185295	3.061740	1056619	1.168591	3.018593	revert	warmdown_frac 0.68->0.60 (reverted, +0.003)
iter_22	0.000000		788	1188.2	38.4	16209103	64907	16144196	32264	1.257494	3.248237	33377	1.262380	3.260859	1054252	1.246209	3.219088	revert	Hessian-aware SDClip (H-weighted per-row std replacing row_std) [over 16MB (16.21MB); idea works (bpb 1.2462) but needs size tuning]
iter_22b	0.000000		790	1188.5	38.4	16617979	64907	16553072	32185	1.257738	3.248867	33335	1.262204	3.260403	1048799	1.246043	3.218658	revert	H-aware SDClip + clip_sigmas 12.5 [over 16.62MB — learned smaller clip_sigmas hurts compression]
iter_22c	0.000000		790	1189.4	38.4	16029028	64907	15964121	32233	1.256997	3.246954	33468	1.262337	3.260749	1053961	1.246111	3.218833	revert	H-aware SDClip + matrix_clip_sigmas 14.0 [over by 29KB]
iter_22d	1.247024	quantized_sliding_window	790	1189.1	38.4	15839637	64907	15774730	32231	1.257401	3.247997	33415	1.263198	3.262971	1053169	1.247024	3.221193	revert	H-aware SDClip + matrix_clip_sigmas 14.5 [+0.0007 bpb vs iter_15b at matched size; H-weighting redundant w/ GPTQ]
iter_23	1.247650	quantized_sliding_window	790	1188.6	38.4	15475507	64992	15410515	32216	1.256988	3.246930	33262	1.263846	3.264645	1052695	1.247650	3.222808	revert	Mixed-bit: int7 layers 0-1, int5 layers 8-10, int6 elsewhere [+0.0013 bpb; int5 too aggressive on 3 layers]
iter_23b	0.000000		789	1188.1	38.4	16562989	64980	16498009	32199	1.257676	3.248708	33329	1.262240	3.260498	1052604	1.246103	3.218813	revert	Mixed-bit: int7 layers 0-2, int5 layer 10, int6 elsewhere [over 16MB (16.56MB); quality slightly better (-0.0002)]
iter_23c	1.246765	quantized_sliding_window	790	1189.0	38.4	15838096	64984	15773112	32191	1.257166	3.247391	33355	1.262946	3.262322	1052220	1.246765	3.220523	revert	Mixed-bit: int7 layers 0-1, int5 layers 9-10 (size-neutral) [+0.0004 bpb at same size; int5 hurts more than int7 helps]
iter_24	1.246156	quantized_sliding_window	791	1189.7	38.4	15825212	64939	15760273	32151	1.256729	3.246262	33355	1.262370	3.260833	1049327	1.246156	3.218951	keep	Per-role SDClip: c_v 1.15x, c_q/c_k 0.95x, attn.proj 1.05x, mlp 1.0x
iter_25	1.357787	quantized_sliding_window	598	1189.8	47.7	15819869	66307	15753562	39912	2.096462	5.415378	42216	1.373968	3.549102	1049311	1.357787	3.507305	revert	MTP 4 heads weight 0.3 (aux loss; heads stripped from submission) [broken eval (MTP loss in val); fixed via self.training gate]
iter_25b	1.357248	quantized_sliding_window	598	1190.0	47.7	15819630	66328	15753302	31533	1.367265	3.531789	33474	1.373278	3.547320	1049872	1.357248	3.505913	revert	MTP 4 heads w=0.3 (self.training gate fix) [MTP overhead: 598 steps vs ~790 baseline; +0.11 bpb regression]
iter_28	0.000000		751	1188.7	39.9	18324706	64940	18259766	31923	1.255898	3.540496	43871	1.260653	3.553902	1111445	1.245979	3.512536	crash	SP16384 vocab (was SP8192) [over 16MB (18.3MB); need embed_dim reduction]
iter_28b	0.000000		0	0	0.0	0	0	0										crash	SP16384, embed_dim=256 (was 512) to fit 16MB
iter_28c	0.000000		766	1188.0	40.0	16012802	65054	15947748	31398	1.274663	3.593398	44888	1.279424	3.606819	1099435	1.264628	3.565107	crash	SP16384, embed_dim=256, fix embed_proj/head_proj Hessian+quant [12.8KB over 16MB; embed_dim=256 too aggressive quality loss]
iter_28d	0.000000		756	1188.2	40.1	17336113	65054	17271059	30930	1.267488	3.573172	46194	1.271390	3.584172	1109626	1.256927	3.543399	crash	SP16384, embed_dim=384 (compromise between 256 and 512) [1.3MB over 16MB (17.3MB); embed_dim=384 still too large + quality regression]
iter_29	0.000000		0	0	0.0	0	0	0										crash	Branch A.1: SP16384 + int6 embeds (embed_clip=13.5)
iter_29b	0.000000		0	0	0.0	0	0	0										crash	Branch A.1: SP16384 + int6 embeds, naive embed quant (no Hessian)
iter_28d	0.000000		0	0	0.0	0	0	0										crash	SP16384, embed_dim=384
iter_29c	0.000000		751	1188.7	39.9	16815317	65560	16749757	31359	1.256011	3.540814	32445	1.290771	3.638806	1089708	1.275811	3.596633	crash	Branch A.1: SP16384 + int6 embeds, naive quant, reduced calib batch [815KB over 16MB; int6 embed too large at clip=13.5]
iter_29d	0.000000		750	1188.4	39.9	18012522	65559	17946963	31395	1.255408	3.539115	32462	1.265769	3.568325	1086254	1.251033	3.526781	crash	Branch A.2: SP16384 + int6 embeds, clip=6.0 (tighter) [18MB; tighter clip=6.0 worsened compression (saturated ints)]
iter_29e	1.379623	quantized_sliding_window	751	1188.2	39.9	15779815	65560	15714255	31370	1.255428	3.539172	32511	1.395813	3.934932	1082945	1.379623	3.889290	revert	Branch A.3: SP16384 + int5 embeds (clip=13.5) [int5 embeds: fits but +0.13 bpb quant damage]
iter_30	0.000000		751	1189.2	39.9	16238462	65560	16172902	31312	1.255967	3.540692	32478	1.321617	3.725764	1085761	1.306226	3.682378	crash	Branch A.4: SP16384 + int6 embeds, clip=20 (wide for compression) [238KB over; int6 embed clip=20 still over budget]
iter_31	1.246496	quantized_sliding_window	791	1188.5	38.4	15804839	64939	15739900	32261	1.256789	3.246415	33427	1.262752	3.261820	1049540	1.246496	3.219829	revert	Branch B.1: c_v 1.15->1.25 (push wider) [c_v=1.25 overshoots: +0.0003 vs c_v=1.15]
iter_32	1.246046	quantized_sliding_window	791	1188.6	38.4	15847465	64939	15782526	32262	1.256813	3.246478	33348	1.262326	3.260719	1049282	1.246046	3.218666	keep	Branch B.2: c_v 1.15->1.05 (check undershoot)
iter_33	1.246383	quantized_sliding_window	790	1188.7	38.4	15836148	64939	15771209	32226	1.256854	3.246585	33356	1.262618	3.261473	1051104	1.246383	3.219536	revert	Branch B.3: c_v=1.10 (between 1.05 and 1.15) [c_v=1.10: +0.0003 vs c_v=1.05]
iter_34	1.246987	quantized_sliding_window	790	1188.5	38.4	15853130	64939	15788191	32228	1.257582	3.248465	33437	1.263227	3.263047	1052908	1.246987	3.221098	revert	Branch B.4: c_v=1.05 + mlp.fc=0.95, mlp.proj=1.05 (differentiate MLP) [MLP differentiation hurts (+0.0009 vs c_v=1.05 alone)]
iter_35	1.246983	quantized_sliding_window	790	1188.1	38.4	15810732	64939	15745793	32275	1.257612	3.248543	33396	1.263153	3.262855	1050123	1.246983	3.221087	revert	Branch B.5: c_v=1.05, c_q/c_k=1.0 (no Q/K tightening), attn.proj=1.05 [c_q/c_k=1.0 hurts; 0.95 tightening was actually helping]
iter_36	1.246685	quantized_sliding_window	790	1188.6	38.4	15810737	64905	15745832	32181	1.257379	3.247941	33374	1.262920	3.262253	1048514	1.246685	3.220318	revert	Branch C.1: flatter K_MUL (1.10->0.90 vs 1.20->0.80) [flatter K_MUL: +0.0006 vs iter_32; steep is better]
iter_37	1.245865	quantized_sliding_window	791	1189.5	38.4	15923950	64905	15859045	32168	1.256408	3.245431	33337	1.262107	3.260154	1050226	1.245865	3.218199	keep	Branch C.2: steeper K_MUL (1.30->0.72 vs 1.20->0.80)
