exp_id	date	parent_commit	commit	hypothesis	verdict	primary_metric	val_bpb	memory_gb	status	notes
AL-20260328-000	2026-03-28	—	—	cu13 torch fails CUDA init on host; cu124 wheel fixes driver mismatch	correct	n/a	n/a	n/a	n/a	env-only; see build log
AL-20260328-001	2026-03-28	—	df152a4	baseline reproduces stable final_int8_ttt_lora on 1 shard	n/a	final_int8_ttt_lora	1.6099	11.9	keep	first full run; train ~10min + TTT eval ~23min on 3090
AL-20260328-002	2026-03-28	df152a4	d9ca661	fewer KV heads → faster steps + lower KV traffic → better bpb in 600s	correct	final_int8_ttt_lora	1.5921	11.4	keep	356 vs 342 steps; NUM_KV_HEADS 4→2 default
AL-20260328-003	2026-03-28	d9ca661	262d70f	half global batch → 2× optimizer steps in same wall → better bpb	correct	final_int8_ttt_lora	1.4239	6.0	keep	695 steps; TRAIN_BATCH_TOKENS 524288→262144 default
AL-20260328-004	2026-03-28	262d70f	bab9bf7	higher Muon matrix LR escapes slow directions faster in fixed wall	correct	final_int8_ttt_lora	1.4129	5.9	keep	MATRIX_LR 0.04→0.06 default
AL-20260329-001	2026-03-29	7d82565	7d82565	baseline reproduces the tuned mar28 defaults on the current system torch stack and may shift the runtime frontier	n_a	final_int8_ttt_lora	1.3990	4.9	keep	751 steps in 600.3s; total int8+zlib artifact 12.64 MB; zlib 1.4313; TTT eval 800s on 3090
AL-20260329-002	2026-03-29	b56e02e	79fbd98	adding one layer will use the current artifact headroom more effectively than it harms fixed-budget step count	wrong	final_int8_ttt_lora	1.4113	5.4	discard	676 steps in 600.5s; artifact 13.67 MB; zlib 1.4424; TTT eval 885s; depth alone lost too many steps
AL-20260329-003	2026-03-29	2f62202	9525840	10 layers can beat the 9-layer baseline if a smaller batch recovers enough optimizer steps under the same 600s budget	correct	final_int8_ttt_lora	1.3916	4.2	keep	878 steps in 600.6s; artifact 14.52 MB; zlib 1.4259; TTT eval 886s; depth was step-starved rather than fundamentally bad
AL-20260329-004	2026-03-29	9449b52	41e9478	after depth-plus-step recovery wins at 196608 tokens, another batch reduction to 131072 will improve further before gradient noise dominates	partial	final_int8_ttt_lora	1.3913	2.9	keep	1208 steps in 600.1s; artifact 15.82 MB; zlib 1.4270; only a 0.0003 improvement over the 196608 run, so likely near the flat part of the frontier
AL-20260329-005	2026-03-29	1bcc1e9	0f3bc82	with 10 layers, reducing KV heads from 2 to 1 can recover attention speed with less batch-noise penalty than pushing batch tokens down to 131072	wrong	final_int8_ttt_lora	1.3973	4.1	discard	896 steps in 600.3s; artifact 13.40 MB; zlib 1.4319; TTT eval 861s; cheaper attention recovered some speed but quality loss outweighed it
AL-20260329-006	2026-03-29	a86b4f1	a86b4f1	at fixed 10-layer depth, a thinner `MLP_MULT=1` may free enough compute to beat the current `MLP_MULT=2` balance	wrong	final_int8_ttt_lora	1.3986	3.7	discard	1044 steps in 600.4s; artifact 11.27 MB; zlib 1.4337; TTT eval 754s; thinner MLP bought more steps and much more artifact headroom, but the capacity loss still outweighed the speed gain
AL-20260329-007	2026-03-29	6164a8a	6164a8a	at fixed 10-layer depth, a wider `MLP_MULT=3` may improve quality enough to justify fewer steps and a larger artifact	wrong	final_int8_ttt_lora	1.4066	4.7	discard	746 steps in 600.8s; artifact 17.43 MB, over the 16 MB cap; zlib 1.4388; TTT eval 1032s; wider MLP was worse than the anchor even before accounting for invalid submission size
AL-20260329-008	2026-03-29	5258c72	5258c72	reallocating width into one more layer via `11L / MLP1` may beat the current `10L / MLP2` balance	wrong	final_int8_ttt_lora	1.4031	4.0	discard	948 steps in 600.2s; artifact 12.03 MB; zlib 1.4375; TTT eval 823s; deeper but thinner was cleaner than pure width, but still clearly worse than the `10L / MLP2` anchor
AL-20260329-009	2026-03-29	0d0f8bb	0d0f8bb	trading one layer for a wider MLP via `9L / MLP3` may be the viable width-oriented frontier	wrong	final_int8_ttt_lora	1.3953	4.2	discard	829 steps in 600.1s; artifact 16.18 MB, slightly over the cap; zlib 1.4279; TTT eval 933s; this was the strongest width branch so far and materially better than `10L / MLP3`, but it still lost to the `10L / MLP2` anchor and missed size validity
AL-20260329-010	2026-03-29	fe477f9	fe477f9	the `9L / MLP3` near-miss may need more optimizer steps rather than a different width-depth ratio	partial	final_int8_ttt_lora	1.3899	3.0	discard	1155 steps in 600.5s; artifact 17.68 MB, well over the cap; zlib 1.4257; TTT eval 933s; more steps flipped the score and produced the best raw `val_bpb` seen so far, but the compression story got worse, so it is still invalid as a challenge frontier
AL-20260329-011	2026-03-29	07d3bcc	07d3bcc	a mild `MODEL_DIM` trim may keep most of the `9L / MLP3 / 131072` gain while recovering challenge-valid size	wrong	final_int8_ttt_lora	1.3970	3.0	discard	1146 steps in 600.2s; artifact 15.64 MB, now valid; zlib 1.4324; TTT eval 926s; the mild dim trim solved the size problem cleanly but gave back too much score to challenge the current valid frontier
AL-20260329-012	2026-03-29	d99bcaa	d99bcaa	most of the width-branch gain may survive if the model keeps `9` layers and `131072` batch but drops from `MLP_MULT=3` to `MLP_MULT=2`	correct	final_int8_ttt_lora	1.3838	2.6	keep	1349 steps in 600.4s; artifact 14.73 MB, valid; zlib 1.4200; TTT eval 801s; one MLP-notch trim kept the width-step interaction while fixing size and produced the new best valid frontier
AL-20260329-013	2026-03-29	2e615f3	2e615f3	a stronger global trim to `DIM448` may recover most of the `9L / MLP3 / 131072` score while staying clearly inside the size cap	partial	final_int8_ttt_lora	1.3915	2.6	discard	1287 steps in 600.2s; artifact 14.19 MB, valid; zlib 1.4273; TTT eval 856s; stronger dim trimming recovered far more score than `DIM480`, but it still trailed the new `9L / MLP2` frontier
AL-20260329-014	2026-03-29	07ae561	07ae561	one less layer may be a cleaner size cut than dropping the third MLP notch inside each block	wrong	final_int8_ttt_lora	1.3921	2.7	discard	1304 steps in 600.1s; artifact 16.29 MB, still invalid; zlib 1.4274; TTT eval 836s; dropping one layer preserved decent quality, but it neither beat `9L / MLP2` nor solved the size problem
AL-20260329-015	2026-03-29	2843d48	2843d48	two light cuts together, one layer plus `DIM480`, may preserve score better than a single aggressive trim	correct	final_int8_ttt_lora	1.3906	2.6	discard	1292 steps in 600.4s; artifact 14.42 MB, valid; zlib 1.4267; TTT eval 829s; the combined light cuts beat the other fallback trims, but still trailed the `9L / MLP2` winner
AL-20260329-016	2026-03-29	22581b4	22581b4	the new `9L / MLP2` winner may still be meaningfully step-limited at `131072` tokens and improve further at `98304`	correct	final_int8_ttt_lora	1.3721	2.0	keep	1718 steps in 600.1s; artifact 15.48 MB, valid; zlib 1.4091; TTT eval 801s; more steps produced a major frontier jump, so the new winner was still under-trained
AL-20260329-017	2026-03-29	b2d8dfb	b2d8dfb	a small matrix-LR increase alone may improve the `9L / MLP2 / 131072` winner without needing a smaller batch	wrong	final_int8_ttt_lora	1.3909	2.6	discard	1348 steps in 600.1s; artifact 14.92 MB, valid; zlib 1.4270; TTT eval 801s; higher LR alone regressed badly, so step recovery mattered much more than this simple optimizer retune
AL-20260329-018	2026-03-29	c94a39d	c94a39d	extra steps and a small matrix-LR bump may only work together on the `9L / MLP2` frontier	partial	final_int8_ttt_lora	1.3786	2.0	discard	1719 steps in 600.1s; artifact 15.55 MB, valid; zlib 1.4148; TTT eval 801s; the combo stayed strong but still gave back clear ground to `98304` alone, so LR did not stack cleanly with the step win
AL-20260329-019	2026-03-29	d048933	d048933	the smaller fallback line `8L / MLP3 / DIM480` may also be step-limited and recover sharply at `98304`	correct	final_int8_ttt_lora	1.3808	2.1	discard	1655 steps in 600.1s; artifact 15.19 MB, valid; zlib 1.4174; TTT eval 830s; extra steps materially improved the fallback line, but not enough to catch the `9L / MLP2 / 98304` frontier
AL-20260329-020	2026-03-29	94fa74a	94fa74a	the fallback line may want both more steps and a small matrix-LR bump, even if the main line did not	wrong	final_int8_ttt_lora	1.3853	2.1	discard	1657 steps in 600.0s; artifact 15.28 MB, valid; zlib 1.4213; TTT eval 829s; the LR bump also hurt the fallback line, so more steps helped but this optimizer tweak did not
AL-20260329-021	2026-03-29	2e78e06	2e78e06	the current frontier may be over-fragmenting attention, so fewer wider query heads (`q4/kv2`) could improve quality	correct	final_int8_ttt_lora	1.3709	2.1	keep	1652 steps in 600.2s; artifact 15.33 MB, valid; zlib 1.4079; TTT eval 813s; fewer wider query heads produced a small but real frontier improvement over `q8/kv2`
AL-20260329-022	2026-03-29	7543df0	7543df0	the current frontier may be under-headed, so more narrower query heads (`q16/kv2`) could improve routing diversity	wrong	final_int8_ttt_lora	1.3968	2.0	discard	1748 steps in 600.2s; artifact 14.40 MB, valid; zlib 1.4313; TTT eval 827s; more narrower heads regressed badly, so the E1 win was directional rather than “any head change helps”
AL-20260329-023	2026-03-29	4f15c99	4f15c99	the stronger frontier may have outgrown `kv2`, so less KV sharing (`q8/kv4`) could recover quality	partial	final_int8_ttt_lora	1.3766	2.1	discard	1649 steps in 600.0s; artifact 15.31 MB, valid; zlib 1.4129; TTT eval 842s; less KV sharing helped versus the old `q8/kv2` anchor, but it still did not beat the `q4/kv2` frontier
AL-20260329-024	2026-03-29	03c306c	03c306c	the current `QK_GAIN_INIT=1.5` may be too sharp for the step-rich frontier, so a softer `QK_GAIN_INIT=1.0` could help	partial	final_int8_ttt_lora	1.3777	2.0	discard	1717 steps in 600.1s; artifact 15.45 MB, valid; zlib 1.4143; TTT eval 801s; softer attention init stayed competitive but still trailed the `q4/kv2` frontier
AL-20260329-025	2026-03-29	01de617	01de617	the current `QK_GAIN_INIT=1.5` may be too conservative for the step-rich frontier, so a sharper `QK_GAIN_INIT=2.0` could help	partial	final_int8_ttt_lora	1.3743	2.0	discard	1717 steps in 600.2s; artifact 15.48 MB, valid; zlib 1.4111; TTT eval 801s; sharper QK init beat the softer bracket, but still did not overtake the `q4/kv2` head-geometry win
AL-20260329-026	2026-03-29	6a734ab	6a734ab	the `q4/kv2` frontier may be output-path-limited, and untied embeddings plus a separate output head could buy enough expressivity to win	correct	final_int8_ttt_lora	1.3614	2.1	keep	1651 steps in 600.1s; artifact 15.78 MB, valid; zlib 1.3962; TTT eval 812s; untied outputs produced a major frontier jump, so output expressivity is now a first-class lever
AL-20260329-027	2026-03-29	30167d0	30167d0	the untied frontier may still be too loosely calibrated, so a tighter `LOGIT_SOFTCAP=20` could improve it further	correct	final_int8_ttt_lora	1.3582	2.1	keep	1651 steps in 600.3s; artifact 15.77 MB, valid; zlib 1.3938; TTT eval 813s; tighter softcap improved the untied frontier again, so calibration matters on top of output expressivity
AL-20260329-028	2026-03-29	62574a1	62574a1	the untied frontier may instead want less saturation, so a looser `LOGIT_SOFTCAP=40` could improve it	partial	final_int8_ttt_lora	1.3628	2.1	discard	1650 steps in 600.1s; artifact 15.77 MB, valid; zlib 1.3974; TTT eval 813s; looser softcap stayed strong but still lost clearly to `LOGIT_SOFTCAP=20`, so the calibration result is directional
AL-20260329-029	2026-03-29	55b5703	55b5703	the untied output head may be learning too aggressively, so a lower `HEAD_LR=0.004` could improve the frontier	partial	final_int8_ttt_lora	1.3596	2.1	discard	1651 steps in 600.2s; artifact 15.74 MB, valid; zlib 1.3942; TTT eval 813s; slower head LR stayed competitive and beat plain untied, but it still trailed `LOGIT_SOFTCAP=20`
AL-20260329-030	2026-03-29	a8333e1	a8333e1	the untied + softcap20 frontier may still want a faster output-head learning rate, and a higher `HEAD_LR=0.012` could improve it further	correct	final_int8_ttt_lora	1.3564	2.1	keep	1650 steps in 600.1s; artifact 15.80 MB, valid; zlib 1.3915; TTT eval 813s; higher head LR improved the untied + softcap20 frontier again, so output-head learning dynamics are a real lever
